{
  "$schema": "https://json-schema.org/draft/2020-12/schema",
  "$id": "https://github.com/posidoni/shell-skill/schemas/codex-plugin.schema.json",
  "title": "Codex Plugin Manifest",
  "description": "Project-local schema for .codex-plugin/plugin.json.",
  "type": "object",
  "required": ["name", "version", "description", "author", "interface"],
  "additionalProperties": true,
  "properties": {
    "id": {
      "type": "string",
      "pattern": "^[a-z0-9][a-z0-9-]*$"
    },
    "name": {
      "type": "string",
      "pattern": "^[a-z0-9][a-z0-9-]*$"
    },
    "version": {
      "type": "string",
      "pattern": "^[0-9]+\\.[0-9]+\\.[0-9]+(?:[-+][0-9A-Za-z.-]+)?$"
    },
    "description": {
      "type": "string",
      "minLength": 20
    },
    "author": {
      "type": "object",
      "required": ["name"],
      "additionalProperties": true,
      "properties": {
        "name": {
          "type": "string",
          "minLength": 1
        },
        "email": {
          "type": "string"
        },
        "url": {
          "type": "string",
          "format": "uri"
        }
      }
    },
    "homepage": {
      "type": "string",
      "format": "uri"
    },
    "repository": {
      "type": "string",
      "format": "uri"
    },
    "license": {
      "type": "string",
      "minLength": 1
    },
    "keywords": {
      "type": "array",
      "items": {
        "type": "string",
        "minLength": 1
      },
      "uniqueItems": true
    },
    "skills": {
      "type": "string",
      "pattern": "^\\./"
    },
    "mcpServers": {
      "type": "string",
      "pattern": "^\\./"
    },
    "apps": {
      "type": "string",
      "pattern": "^\\./"
    },
    "interface": {
      "type": "object",
      "required": [
        "displayName",
        "shortDescription",
        "longDescription",
        "developerName",
        "category",
        "capabilities",
        "defaultPrompt"
      ],
      "additionalProperties": true,
      "properties": {
        "displayName": {
          "type": "string",
          "minLength": 1
        },
        "shortDescription": {
          "type": "string",
          "minLength": 10,
          "maxLength": 80
        },
        "longDescription": {
          "type": "string",
          "minLength": 20
        },
        "developerName": {
          "type": "string",
          "minLength": 1
        },
        "category": {
          "type": "string",
          "minLength": 1
        },
        "capabilities": {
          "type": "array",
          "minItems": 1,
          "items": {
            "type": "string",
            "minLength": 1
          }
        },
        "defaultPrompt": {
          "type": "array",
          "minItems": 1,
          "maxItems": 3,
          "items": {
            "type": "string",
            "minLength": 1,
            "maxLength": 128
          }
        },
        "brandColor": {
          "type": "string",
          "pattern": "^#[0-9a-fA-F]{6}$"
        }
      }
    }
  }
}
